id,title,subtitle,authors,publisher,published_date,category,distribution_expense
1461471370,An Introduction to Statistical Learning,with Applications in R,"Gareth James, Daniela Witten, Trevor Hastie, Robert Tibshirani",Springer,2014-07-11,R Studio,5.6
3031004604,Graph Representation Learning,,William L. Hamilton,Springer,2020-09-16,R Studio,4.55
9781350000000,Posthumanism and the Digital University,"Texts, Bodies and Materialities",Lesley Gourlay,Bloomsbury Publishing,2020-12-10,R Studio,5.6
9781120000000,Deep Learning,From Big Data to Artificial Intelligence with R,Stephane S. Tuffery,John Wiley & Sons,2023-01-10,R Studio,4.22
9781000000000,"Artificial Intelligence for Drug Development, Precision Medicine, and Healthcare",,Mark Chang,CRC Press,2020-05-12,R Studio,3.19
UCAL:B4282287,"Black Scientists, White Society, and Colorless Science",A Study of Universalism in American Science,Willie Pearson,Associated Faculty PressInc,1985-01-01,R Studio,6.9
UCSD:31822032277600,Plate Boundary Zones,,"Seth Stein, Jeffrey T. Freymueller",American Geophysical Union,2002-01-21,R Studio,7.3
UOM:39015029885772,Satellite Altimetry in Geodesy and Oceanography,,"Reiner Rummel, Fernando Sansò",Springer,1993-06-23,R Studio,4.55
UOM:39015024192067,Annual Review of Information Science and Technology,,Carlos A. Cuadra,Encyclopaedia Britannica,1970-01-01,R Studio,5.6
UOM:39015017938450,Neutron Scattering for Materials Science: Volume 166,,"S. M. Shapiro, S. C. Moss, J. D. Jorgensen",Mrs Proceedings,1990-04-11,R Studio,4.22
UOM:39015009380604,Yearbook of Higher Education,1982-83,"Marquis Whos Who, LLC",Marquis Who's Who,1982-12-01,R Studio,3.19
9781260000000,Applied Machine Learning,,M GOPAL,McGraw Hill Professional,2019-06-07,R Studio,6.9
768921554,"Peterson's Graduate Programs in the Physical Sciences, Mathematics, Agricultural Sciences, the Environment and Natural Resources 2007",Book 4,"Petersons Guides Staff, Petersons Guides, Inc",Petersons,2006-11-01,R Studio,7.3
UOM:39015009811004,Online Bibliographic Searching,A Learning Manual,"Ching-chih Chen, Jingzhi Zhen, Susanna Schweizer",New York : Neal-Schuman Publishers,1981-01-01,R Studio,4.55
OSU:32435019744671,Yearbook of International Organizations,,Union of International Associations,International Publications Service,1981-12-01,R Studio,5.6
9781120000000,SQL for Data Scientists,A Beginner's Guide for Building Datasets for Analysis,Renee M. P. Teate,John Wiley & Sons,2021-08-17,SQL,4.22
9783030000000,SQL for Data Science,"Data Cleaning, Wrangling and Analytics with Relational Databases",Antonio Badia,Springer Nature,2020-12-11,SQL,3.19
1119669367,SQL for Data Scientists,A Beginner's Guide for Building Datasets for Analysis,Renee M. P. Teate,Wiley,2021-09-15,SQL,6.9
9781490000000,SQL for Data Analysis,,Cathy Tanimura,"""O'Reilly Media, Inc.""",2021-09-09,SQL,7.3
9781790000000,Data Science with SQL Server Quick Start Guide,Integrate SQL Server with data science,Dejan Sarka,Packt Publishing Ltd,2018-08-31,SQL,4.55
9780470000000,Data Analysis Using SQL and Excel,,Gordon S. Linoff,John Wiley & Sons,2010-09-16,SQL,5.6
9781490000000,Data Science from Scratch,First Principles with Python,Joel Grus,"""O'Reilly Media, Inc.""",2015-04-14,SQL,4.22
9781490000000,Data Science on AWS,,"Chris Fregly, Antje Barth","""O'Reilly Media, Inc.""",2021-04-07,SQL,3.19
9781480000000,SQL Server Big Data Clusters,"Data Virtualization, Data Lake, and AI Platform","Benjamin Weissman, Enrico van de Laar",Apress,2020-05-23,SQL,6.9
9780600000000,Learning SQL,Master SQL Fundamentals,Alan Beaulieu,O'Reilly Media,2009-04-11,SQL,7.3
9781490000000,Data Science on the Google Cloud Platform,Implementing End-to-End Real-Time Data Pipelines: From Ingest to Machine Learning,Valliappa Lakshmanan,"""O'Reilly Media, Inc.""",2017-12-12,SQL,4.55
9781790000000,Hands-On Data Science with SQL Server 2017,Perform end-to-end data analysis to gain efficient data insight,"Marek Chmel, Vladimír Mužný",Packt Publishing Ltd,2018-11-29,SQL,5.6
9781120000000,The Big R-Book,From Data Science to Learning Machines and Big Data,Philippe J. S. De Brouwer,John Wiley & Sons,2020-10-16,SQL,4.55
9781480000000,SQL Primer,An Accelerated Introduction to SQL Basics,Rahul Batra,Apress,2018-06-15,SQL,5.6
9781590000000,Practical SQL,A Beginner's Guide to Storytelling with Data,Anthony DeBarros,No Starch Press,2018-05-01,SQL,4.22
9781490000000,Getting Started with SQL,A Hands-On Approach for Beginners,Thomas Nield,"""O'Reilly Media, Inc.""",2016-02-11,SQL,3.19
9781790000000,Scala for Data Science,,Pascal Bugnion,Packt Publishing Ltd,2016-01-28,SQL,6.9
9781490000000,Practical Data Science with SAP,Machine Learning Techniques for Enterprise Data,"Greg Foss, Paul Modderman",O'Reilly Media,2019-09-18,SQL,7.3
9781640000000,Build a Career in Data Science,,"Emily Robinson, Jacqueline Nolis",Simon and Schuster,2020-03-06,SQL,4.55
9781450000000,Building Data Science Teams,,DJ Patil,"""O'Reilly Media, Inc.""",2011-09-15,SQL,5.6
9781490000000,Python Data Science Handbook,Essential Tools for Working with Data,Jake VanderPlas,"""O'Reilly Media, Inc.""",2016-11-21,SQL,4.22
9781490000000,R for Data Science,"Import, Tidy, Transform, Visualize, and Model Data","Hadley Wickham, Garrett Grolemund","""O'Reilly Media, Inc.""",2016-12-12,SQL,3.19
9781640000000,Introducing Data Science,"Big data, machine learning, and more, using Python tools","Davy Cielen, Arno Meysman",Simon and Schuster,2016-05-02,SQL,6.9
9780130000000,SQL Queries for Mere Mortals,A Hands-On Guide to Data Manipulation in SQL,"John L. Viescas, Michael J. Hernandez",Addison-Wesley Professional,2014-06-10,SQL,7.3
9781120000000,SAS for R Users,A Book for Data Scientists,Ajay Ohri,John Wiley & Sons,2019-09-24,SQL,4.55
9781120000000,Data Science Using Python and R,,"Chantal D. Larose, Daniel T. Larose",John Wiley & Sons,2019-04-09,SQL,5.6
9781450000000,Python Cookbook,Recipes for Mastering Python 3,"David Beazley, Brian K. Jones","""O'Reilly Media, Inc.""",2013-05-10,SQL,4.22
9781490000000,Graph Algorithms,Practical Examples in Apache Spark and Neo4j,"Mark Needham, Amy E. Hodler","""O'Reilly Media, Inc.""",2019-05-16,SQL,3.19
9780990000000,Negotiating for Success: Essential Strategies and Skills,,George J. Siedel,"Van Rye Publishing, LLC",2014-10-04,SQL,6.9
9781490000000,Practical Statistics for Data Scientists,50 Essential Concepts,"Peter Bruce, Andrew Bruce","""O'Reilly Media, Inc.""",2017-05-10,SQL,7.3
9781720000000,"Practical SQL, 2nd Edition",A Beginner's Guide to Storytelling with Data,Anthony DeBarros,No Starch Press,2022-01-25,SQL,4.55
9781490000000,Python for Data Analysis,"Data Wrangling with Pandas, NumPy, and IPython",Wes McKinney,"""O'Reilly Media, Inc.""",2017-09-25,SQL,5.6
9781000000000,Introduction to Data Science,Data Analysis and Prediction Algorithms with R,Rafael A. Irizarry,CRC Press,2019-11-20,SQL,4.22
1558605762,Joe Celko's SQL for Smarties,Advanced SQL Programming Second Edition,Joe Celko,Morgan Kaufmann,1999-10-11,SQL,3.19
9780530000000,Learning How to Learn,How to Succeed in School Without Spending All Your Time Studying; A Guide for Kids and Teens,"Barbara Oakley, PhD, Terrence Sejnowski, PhD, Alistair McConville",Penguin,2018-08-07,SQL,6.9
9781120000000,Smarter Data Science,Succeeding with Enterprise-Grade Data and AI Projects,"Neal Fishman, Cole Stryker",John Wiley & Sons,2020-04-14,SQL,7.3
9781120000000,Responsible Data Science,,"Peter C. Bruce, Grant Fleming",John Wiley & Sons,2021-04-13,SQL,4.55
9780130000000,T-SQL Querying,,"Itzik Ben-Gan, Adam Machanic, Dejan Sarka, Kevin Farlee",Microsoft Press,2015-02-17,SQL,5.6
9781510000000,T-SQL Fundamentals,,Itzik Ben-Gan,Microsoft Press,2016-07-29,SQL,4.22
9781450000000,Learning Spark,Lightning-Fast Big Data Analysis,"Holden Karau, Andy Konwinski, Patrick Wendell, Matei Zaharia","""O'Reilly Media, Inc.""",2015-01-28,SQL,3.19
9781840000000,Hands-On Machine Learning with scikit-learn and Scientific Python Toolkits,A practical guide to implementing supervised and unsupervised machine learning algorithms in Python,Tarek Amr,Packt Publishing Ltd,2020-07-24,SQL,6.9
9780600000000,Head First SQL,Your Brain on SQL -- A Learner's Guide,Lynn Beighley,"""O'Reilly Media, Inc.""",2007-08-28,SQL,7.3
9781450000000,Doing Data Science,Straight Talk from the Frontline,"Cathy ONeil, Rachel Schutt","""O'Reilly Media, Inc.""",2013-10-09,SQL,4.55
9781950000000,SQL QuickStart Guide,"The Simplified Beginner's Guide to Managing, Analyzing, and Manipulating Data With SQL",Walter Shields,ClydeBank Media LLC,2019-11-18,SQL,5.6
9781120000000,Data Science For Dummies,,Lillian Pierson,John Wiley & Sons,2017-03-06,SQL,4.22
9780130000000,"SQL in 10 Minutes, Sams Teach Yourself",,Ben Forta,Sams Publishing,2012-10-25,SQL,3.19
9781460000000,R for Business Analytics,,A Ohri,Springer Science & Business Media,2012-09-14,SQL,6.9
9781120000000,The Boston Consulting Group on Strategy,Classic Concepts and New Perspectives,"Carl W. Stern, Michael S. Deimler",John Wiley & Sons,2012-06-14,SQL,7.3
9781000000000,Data Science and Its Applications,,"Aakanksha Sharaff, G R Sinha",CRC Press,2021-08-18,SQL,4.55
9781120000000,Excel 2016 Bible,,John Walkenbach,John Wiley & Sons,2015-10-26,SQL,5.6
UOM:39015034891690,Relational Database Systems,,"Dan A. Simovici, Richard L. Tenney",Academic Press,1995-08-15,SQL,4.55
9781000000000,A Tour of Data Science,Learn R and Python in Parallel,Nailong Zhang,CRC Press,2020-11-11,SQL,5.6
9781630000000,NoSQL and SQL Data Modeling,"Bringing Together Data, Semantics, and Software",Ted Hills,Technics Publications,2016-04-01,SQL,4.22
9781450000000,SQL in a Nutshell,A Desktop Quick Reference,"Kevin Kline, Brand Hunt, Daniel Kline","""O'Reilly Media, Inc.""",2004-09-24,SQL,3.19
1572229160,SQL Guide,,"John Hales, BarCharts Inc., Staff",Quickstudy,2005-01-01,SQL,6.9
9780140000000,"SQL in 10 Minutes a Day, Sams Teach Yourself",,Ben Forta,Sams Publishing,2019-10-29,SQL,7.3
9781450000000,Introduction to Machine Learning with Python,A Guide for Data Scientists,"Andreas C. Müller, Sarah Guido","""O'Reilly Media, Inc.""",2016-09-26,SQL,4.55
9780600000000,The Art of SQL,,"Stephane Faroult, Peter Robson","""O'Reilly Media, Inc.""",2006-03-10,SQL,5.6
9780600000000,Head First Statistics,,Dawn Griffiths,"""O'Reilly Media, Inc.""",2008-08-26,SQL,4.22
9781620000000,"PostGIS in Action, Third Edition",,"Leo S. Hsu, Regina Obe",Simon and Schuster,2021-09-21,SQL,3.19
9781730000000,Rise of the Data Cloud,,"Frank Slootman, Steve Hamm",AuthorHouse,2020-12-18,SQL,6.9
9781780000000,Pandas Cookbook,"Recipes for Scientific Computing, Time Series Analysis and Data Visualization using Python",Theodore Petrou,Packt Publishing Ltd,2017-10-23,SQL,7.3
9781120000000,SQL For Dummies,,Allen G. Taylor,John Wiley & Sons,2018-12-11,SQL,4.55
9781480000000,Beginning SQL Server R Services,Analytics for Data Scientists,Bradley Beard,Apress,2016-11-11,SQL,5.6
9780470000000,SQL All-in-One For Dummies,,Allen G. Taylor,John Wiley & Sons,2011-04-05,SQL,4.22
9781840000000,Deep Learning with TensorFlow 2 and Keras,"Regression, ConvNets, GANs, RNNs, NLP, and more with TensorFlow 2 and the Keras API, 2nd Edition","Antonio Gulli, Amita Kapoor, Sujit Pal",Packt Publishing Ltd,2019-12-27,SQL,3.19
1727287320,Heard in Data Science Interviews,Over 650 Most Commonly Asked Interview Questions and Answers,Kal Mishra,Createspace Independent Publishing Platform,2018-10-03,SQL,6.9
9781120000000,Data Science and Big Data Analytics,"Discovering, Analyzing, Visualizing and Presenting Data",EMC Education Services,John Wiley & Sons,2015-01-05,SQL,7.3
1634629663,Building the Data Lakehouse,,"Bill Inmon, Ranjeet Srivastava, Mary Levins",Technics Publications,2021-10-01,SQL,4.55
9781490000000,Data Pipelines Pocket Reference,,James Densmore,O'Reilly Media,2021-02-10,SQL,5.6
9781790000000,40 Algorithms Every Programmer Should Know,Hone your problem-solving skills by learning different algorithms and their implementation in Python,Imran Ahmad,Packt Publishing Ltd,2020-06-12,SQL,4.22
9781640000000,Think Like a Data Scientist,Tackle the data science process step-by-step,Brian Godsey,Simon and Schuster,2017-03-09,SQL,3.19
9781790000000,Artificial Intelligence with Python,,Prateek Joshi,Packt Publishing Ltd,2017-01-27,SQL,6.9
9781450000000,Think Stats,,Allen B. Downey,"""O'Reilly Media, Inc.""",2011-07-01,SQL,7.3
9781450000000,Learning Python,Powerful Object-Oriented Programming,Mark Lutz,"""O'Reilly Media, Inc.""",2013-06-12,SQL,4.55
9781640000000,Learn SQL Server Administration in a Month of Lunches,,Don Jones,Simon and Schuster,2014-04-30,SQL,5.6
9781490000000,High Performance Python,Practical Performant Programming for Humans,"Micha Gorelick, Ian Ozsvald",O'Reilly Media,2020-04-30,SQL,4.22
1540422658,SQL Practice Problems,"57 Beginning, Intermediate, and Advanced Challenges for You to Solve Using a ""Learn-by-doing"" Approach",Sylvia Moestl Vasilik,Createspace Independent Publishing Platform,2016-11-09,SQL,3.19
9781460000000,Relational Database Systems,,Jitendra Patel,eBookIt.com,2012-12-01,SQL,6.9
9781790000000,SQL Server 2017 Machine Learning Services with R,"Data exploration, modeling, and advanced analytics","Tomaz Kastrun, Julie Koesmarno",Packt Publishing Ltd,2018-02-27,SQL,7.3
9781450000000,Machine Learning for Hackers,Case Studies and Algorithms to Get You Started,"Drew Conway, John Myles White","""O'Reilly Media, Inc.""",2012-02-13,SQL,4.55
9781780000000,Mastering Python for Data Science,,Samir Madhavan,Packt Publishing Ltd,2015-08-31,SQL,5.6
9781630000000,Experimentation Works,The Surprising Power of Business Experiments,Stefan H. Thomke,Harvard Business Press,2020-02-18,SQL,4.22
9781590000000,"Automate the Boring Stuff with Python, 2nd Edition",Practical Programming for Total Beginners,Al Sweigart,No Starch Press,2019-11-12,SQL,3.19
9781530000000,Measurement and Data Science,,Gábor Péceli,Cambridge Scholars Publishing,2021-01-06,SQL,6.9
9780130000000,Bayesian Methods for Hackers,Probabilistic Programming and Bayesian Inference,Cameron Davidson-Pilon,Addison-Wesley Professional,2015-09-30,SQL,7.3
9386551934,Machine Learning with Python,,Abhishek Vijayvargia,BPB Publications,2018-03-01,SQL,4.55
9781450000000,The Art of Readable Code,Simple and Practical Techniques for Writing Better Code,"Dustin Boswell, Trevor Foucher","""O'Reilly Media, Inc.""",2011-11-03,SQL,5.6
1617291560,Practical Data Science with R,,"Nina Zumel, John Mount",Manning Publications,2014-04-10,SQL,4.55
9781120000000,The Unlucky Investor's Guide to Options Trading,,Julia Spina,John Wiley & Sons,2022-02-23,SQL,5.6
9780130000000,NoSQL Distilled,A Brief Guide to the Emerging World of Polyglot Persistence,"Pramod J. Sadalage, Martin Fowler",Addison-Wesley,2012-08-08,SQL,4.22
9781790000000,SQL Server 2016 Developer's Guide,,"Dejan Sarka, Milos Radivojevic, William Durkin",Packt Publishing Ltd,2017-03-22,SQL,3.19
9781480000000,Managing Your Data Science Projects,"Learn Salesmanship, Presentation, and Maintenance of Completed Models",Robert de Graaf,Apress,2019-06-07,SQL,6.9
9780140000000,The Signal and the Noise,Why So Many Predictions Fail--but Some Don't,Nate Silver,Penguin,2015-02-03,SQL,7.3
9781490000000,R Packages,"Organize, Test, Document, and Share Your Code",Hadley Wickham,"""O'Reilly Media, Inc.""",2015-03-26,SQL,4.55
9780390000000,All of Statistics,A Concise Course in Statistical Inference,Larry Wasserman,Springer Science & Business Media,2013-12-11,SQL,5.6
9781510000000,Microsoft Excel 2019 Data Analysis and Business Modeling,,Wayne Winston,Microsoft Press,2019-03-28,SQL,4.22
9781800000000,Data Science Projects with Python,A case study approach to gaining valuable insights from real data with machine learning,Stephen Klosterman,Packt Publishing Ltd,2021-07-29,SQL,3.19
9789390000000,Learn SQL with MySQL,,Pajankar Ashwin,BPB Publications,2020-09-03,SQL,6.9
9780130000000,Inflection Point,"How the Convergence of Cloud, Mobility, Apps, and Data Will Shape the Future of Business",Scott Stawski,FT Press,2015-08-27,SQL,7.3
9783320000000,Data Science in Practice,,"Alan Said, Vicenç Torra",Springer,2018-09-19,SQL,4.55
9780820000000,Introduction to Probability,,"Charles Miller Grinstead, James Laurie Snell",American Mathematical Soc.,2012-10-30,SQL,5.6
1720283842,Introduction to Blockchain: With Case Studies,,Zeeshan-Ul-Hassan Usmani,Independently Published,2018-09-13,SQL,4.22
9781420000000,The Johns Hopkins Guide to Psychological First Aid,,"George S. Everly, Jr., Jeffrey M. Lating",JHU Press,2022-08-02,SQL,3.19
1977921752,Illustrated Guide to Python 3,A Complete Walkthrough of Beginning Python With Unique Illustrations Showing How Python Really Works. Now Covering Python 3.6,Matt Harrison,Createspace Independent Publishing Platform,2017-11-03,SQL,6.9
80491685,Joe Celko's SQL Puzzles and Answers,,Joe Celko,Elsevier,2006-10-09,SQL,7.3
9780390000000,Dataclysm,"Love, Sex, Race, and Identity--What Our Online Lives Tell Us about Our Offline Selves",Christian Rudder,Crown,2015-09-08,SQL,4.55
3030439836,Principles of Data Science,,"Hamid R. Arabnia, Kevin Daimi, Robert Stahlbock, Cristina Soviany, Leonard Heilig, Kai Brüssau",Springer,2021-07-09,SQL,5.6
9781120000000,Predictive Analytics,"The Power to Predict Who Will Click, Buy, Lie, or Die",Eric Siegel,John Wiley & Sons,2016-01-13,SQL,4.22
9781110000000,Data-Driven Science and Engineering,"Machine Learning, Dynamical Systems, and Control","Steven L. Brunton, J. Nathan Kutz",Cambridge University Press,2019-02-28,SQL,3.19
9781620000000,"Machine Learning with TensorFlow, Second Edition",,Mattmann A. Chris,Manning Publications,2021-02-02,SQL,6.9
9780260000000,Machine Learning,A Probabilistic Perspective,Kevin P. Murphy,MIT Press,2012-08-24,SQL,7.3
9781450000000,Hadoop: The Definitive Guide,,Tom White,"""O'Reilly Media, Inc.""",2010-09-24,SQL,4.55
9781490000000,Analytical Skills for AI and Data Science,Building Skills for an AI-Driven Enterprise,Daniel Vaughan,O'Reilly Media,2020-05-21,SQL,5.6
9780060000000,Data-ism,"The Revolution Transforming Decision Making, Consumer Behavior, and Almost Everything Else",Steve Lohr,Harper Collins,2015-03-10,SQL,4.55
9781110000000,Mathematics for Machine Learning,,"Marc Peter Deisenroth, A. Aldo Faisal, Cheng Soon Ong",Cambridge University Press,2020-04-23,SQL,5.6
9781790000000,SQL Server 2017 Integration Services Cookbook,,"Christian Cote, Matija Lah, Dejan Sarka",Packt Publishing Ltd,2017-06-30,SQL,4.22
9781110000000,Foundations of Data Science,,"Avrim Blum, John Hopcroft, Ravindran Kannan",Cambridge University Press,2020-01-23,SQL,3.19
9783030000000,Linear Algebra and Optimization for Machine Learning,A Textbook,Charu C. Aggarwal,Springer Nature,2020-05-13,SQL,6.9
9798580000000,Data Analytics Basics,A Beginner’s Guide,Simplilearn,IndraStra Whitepapers,2020-12-14,SQL,7.3
9780810000000,Think Bigger,Developing a Successful Big Data Strategy for Your Business,Mark Van Rijmenam,AMACOM,2014-04-03,SQL,4.55
9780750000000,Confident Data Skills,Master the Fundamentals of Working with Data and Supercharge Your Career,Kirill Eremenko,Kogan Page Publishers,2018-01-03,SQL,5.6
9781120000000,Data Smart,Using Data Science to Transform Information into Insight,John W. Foreman,John Wiley & Sons,2013-10-31,SQL,4.22
1493938436,Pattern Recognition and Machine Learning,,Christopher M. Bishop,Springer,2016-08-23,SQL,3.19
9781490000000,The Hitchhiker's Guide to Python,Best Practices for Development,"Kenneth Reitz, Tanya Schlusser","""O'Reilly Media, Inc.""",2016-08-30,SQL,6.9
9789390000000,Data Science for Business Professionals,A Practical Guide for Beginners (English Edition),Probyto Data Science and Consulting Pvt. Ltd.,BPB Publications,2020-05-06,SQL,7.3
148425984X,SQL Server Big Data Clusters,"Data Virtualization, Data Lake, and AI Platform","Benjamin Weissman, Enrico van de Laar",Apress,2020-06-17,SQL,4.55
9781450000000,Data Science for Business,What You Need to Know about Data Mining and Data-Analytic Thinking,"Foster Provost, Tom Fawcett","""O'Reilly Media, Inc.""",2013-07-27,SQL,5.6
9781450000000,The River of Consciousness,,Oliver Sacks,Pan Macmillan,2017-10-19,SQL,4.22
9781120000000,Tableau For Dummies,,"Molly Monsey, Paul Sochan",John Wiley & Sons,2015-10-14,SQL,3.19
9781490000000,Deep Learning for Coders with fastai and PyTorch,,"Jeremy Howard, Sylvain Gugger","""O'Reilly Media, Inc.""",2020-06-29,SQL,6.9
8131707490,Software Architecture: A Case Based Approach,,"Vasudeva Varma, Varma Vasudeva",Pearson Education India,2009-09-01,SQL,7.3
9781680000000,A Common-Sense Guide to Data Structures and Algorithms,Level Up Your Core Programming Skills,Jay Wengrow,Pragmatic Bookshelf,2017-08-03,SQL,4.55
9781790000000,Hands-On Machine Learning with Azure,Build powerful models with cognitive machine learning and artificial intelligence,"Thomas K Abraham, Parashar Shah, Jen Stirrup, Lauri Lehman, Anindita Basak",Packt Publishing Ltd,2018-10-31,SQL,5.6
9780260000000,"Fundamentals of Machine Learning for Predictive Data Analytics, second edition","Algorithms, Worked Examples, and Case Studies","John D. Kelleher, Brian Mac Namee, Aoife DArcy",MIT Press,2020-10-20,SQL,4.22
9780470000000,Data Mining Techniques,"For Marketing, Sales, and Customer Relationship Management","Michael J. A. Berry, Gordon S. Linoff",John Wiley & Sons,2004-04-09,SQL,3.19
9781110000000,Computer Age Statistical Inference,,"Bradley Efron, Trevor Hastie",Cambridge University Press,2016-07-21,SQL,6.9
9781490000000,Python for Excel,,Felix Zumstein,"""O'Reilly Media, Inc.""",2021-03-04,SQL,7.3
9783030000000,Data Science for Healthcare,Methodologies and Applications,"Sergio Consoli, Diego Reforgiato Recupero, Milan Petković",Springer,2019-02-23,SQL,4.55
1721242163,Python Tutorial,Release 3. 6. 6rc1,Guido Rossum,Createspace Independent Publishing Platform,2018-06-19,SQL,5.6
1484249062,Managing Your Data Science Projects,"Learn Salesmanship, Presentation, and Maintenance of Completed Models",Robert de Graaf,Apress,2019-06-08,SQL,4.22
9781790000000,Mastering Java for Data Science,,Alexey Grigorev,Packt Publishing Ltd,2017-04-27,SQL,3.19
9781460000000,Applied Predictive Modeling,,"Max Kuhn, Kjell Johnson",Springer Science & Business Media,2013-05-17,SQL,6.9
9781790000000,SQL Server 2017 Developer’s Guide,A professional guide to designing and developing enterprise database applications,"William Durkin, Miloš Radivojević, Dejan Sarka",Packt Publishing Ltd,2018-03-16,SQL,7.3
9781470000000,SAS and R,"Data Management, Statistical Analysis, and Graphics, Second Edition","Ken Kleinman, Nicholas J. Horton",CRC Press,2014-07-17,SQL,4.55
9781630000000,Good Charts,"The HBR Guide to Making Smarter, More Persuasive Data Visualizations",Scott Berinato,Harvard Business Review Press,2016-04-26,SQL,5.6
9780130000000,Pandas for Everyone,Python Data Analysis,Daniel Y. Chen,Addison-Wesley Professional,2017-12-15,SQL,4.22
9781790000000,SQL Server 2017 Administrator's Guide,"One stop solution for DBAs to monitor, manage, and maintain enterprise databases","Marek Chmel, Vladimir Muzny",Packt Publishing Ltd,2017-12-12,SQL,3.19
9780130000000,Clean Architecture,A Craftsman's Guide to Software Structure and Design,Robert C. Martin,Prentice Hall,2017-09-12,SQL,6.9
9780140000000,SQL Server 2019 Administration Inside Out,,"Randolph West, Melody Zacharias, William Assaf, Sven Aelterman, Louis Davidson, Joseph DAntoni",Microsoft Press,2020-03-11,SQL,7.3
9781490000000,Fundamentals of Deep Learning,Designing Next-Generation Machine Intelligence Algorithms,"Nikhil Buduma, Nicholas Locascio","""O'Reilly Media, Inc.""",2017-05-25,SQL,4.55
9780520000000,Data Mining and Analysis,Fundamental Concepts and Algorithms,"Mohammed J. Zaki, Wagner Meira, Jr, Wagner Meira",Cambridge University Press,2014-05-12,SQL,5.6
134872983,Differential Equations and Boundary Value Problems,"Computing and Modeling Tech Update, Books a la Carte Edition","C. Henry Edwards, David E. Penney, David Calvis",Pearson,2018-01-30,SQL,4.55
9780130000000,Effective SQL,61 Specific Ways to Write Better SQL,"John L. Viescas, Douglas J. Steele, Ben G. Clothier",Addison-Wesley Professional,2017-01-09,SQL,5.6
1506094384,Learn Python in One Day and Learn It Well,Python for Beginners with Hands-On Project. the Only Book You Need to Start Coding in Python Immediately,Jamie Chan,CreateSpace,2015-01-07,SQL,4.22
1484230531,Practical Data Science,A Guide to Building the Technology Stack for Turning Data Lakes into Business Assets,Andreas François Vermeulen,Apress,2018-02-22,SQL,3.19
9781490000000,I Heart Logs,"Event Data, Stream Processing, and Data Integration",Jay Kreps,"""O'Reilly Media, Inc.""",2014-09-23,SQL,6.9
9781490000000,"Hands-On Machine Learning with Scikit-Learn, Keras, and TensorFlow","Concepts, Tools, and Techniques to Build Intelligent Systems",Aurélien Géron,"""O'Reilly Media, Inc.""",2019-09-05,SQL,7.3
9780260000000,Deep Learning,,"Ian Goodfellow, Yoshua Bengio, Aaron Courville",MIT Press,2016-11-10,SQL,4.55
9780060000000,The Visual Miscellaneum,A Colorful Guide to the World's Most Consequential Trivia,David McCandless,HarperCollins,2014-10-21,SQL,5.6
1492086002,Hands-On Data Visualization,Interactive Storytelling from Spreadsheets to Code,"Jack Dougherty, Ilya Ilyankou",O'Reilly Media,2021-04-30,SQL,4.22
9781780000000,Python Machine Learning,,Sebastian Raschka,Packt Publishing Ltd,2015-09-23,SQL,3.19
1500789240,Bootstrapping Machine Learning,The First Guide to Prediction APIs,Louis Dorard,CreateSpace,2014-08-11,SQL,6.9
9781490000000,Natural Language Processing with PyTorch,Build Intelligent Language Applications Using Deep Learning,"Delip Rao, Brian McMahan",O'Reilly Media,2019-01-22,SQL,7.3
9781850000000,Big Data,"The Essential Guide to Work, Life and Learning in the Age of Insight","Viktor Mayer-Schonberger, Kenneth Cukier",Hachette UK,2013-03-14,SQL,4.55
9781110000000,Mining of Massive Datasets,,"Jure Leskovec, Anand Rajaraman, Jeffrey David Ullman",Cambridge University Press,2014-11-13,SQL,5.6
